{
  "$schema": "https://json-schema.org/draft/2020-12/schema",
  "$id": "https://harmonicbeacon.com/contracts/early-bird-membership/v2/result.schema.json",
  "title": "EarlyBird membership result v1",
  "type": "object",
  "additionalProperties": false,
  "required": ["schema_version", "membership_id", "account_id", "outcome", "applied_revision", "effective_state", "access_allowed", "reconciliation_required"],
  "properties": {
    "schema_version": {"const": "early-bird-membership.result.v1"},
    "membership_id": {"type": "string", "format": "uuid"},
    "account_id": {"type": "string", "minLength": 1, "maxLength": 128, "pattern": "^[A-Za-z0-9][A-Za-z0-9._~-]{0,127}$"},
    "outcome": {"enum": ["APPLIED", "REPLAYED", "STALE"]},
    "applied_revision": {"type": "integer", "minimum": 1},
    "effective_state": {"enum": ["PENDING", "ACTIVE", "GRACE", "CANCELLED_PENDING_END", "EXPIRED", "REFUNDED", "REVOKED"]},
    "access_allowed": {"type": "boolean"},
    "reconciliation_required": {"type": "boolean"}
  }
}
